run_time,agent_name,display_name,role_label,accent,finding_count,priority_level,summary,recommended_action,summary_source
2026-05-14T11:05:57,inventory_agent,Inventory,Stock & demand,blue,59,High,59 findings were flagged. 17 high demand items. 5 low stock items. 1 stockout risks.,Review the latest items and act on the highest priority rows first.,fallback
2026-05-14T11:05:57,pricing_agent,Pricing,Discount strategy,purple,76,High,76 findings were flagged. Inventory coverage is high compared with recent sales velocity.,Consider a discount to improve sell-through.,fallback
2026-05-14T11:05:57,transfer_agent,Transfer / Supply,Store balancing,teal,3,Medium,3 findings were flagged. One store is below reorder point while another store has surplus stock.,Transfer 2 units from S1 to S2.,fallback
2026-05-14T11:05:57,risk_agent,Risk,Risk monitoring,orange,46,High,46 findings were flagged. Supplier reliability or delivery time crosses the configured risk threshold.,Review supplier performance before placing the next replenishment order.,fallback
2026-05-14T11:05:57,procurement_agent,Procurement,Reorder planning,green,5,High,5 findings were flagged. Stock is below the reorder point and supplier risk may delay replenishment.,Reorder 4 units. Review supplier timing before placing the order.,fallback
